isoCode,name_en,name_pt,name_fr,name_it,name_es,flagUrl,description_en,description_pt,description_fr,description_it,description_es,capital,largestCity,population,areaKm2,densityKm2,government,officialLanguage,demonym,gdp,hdi,currency,timeZone,callingCode,internetTld
"KR","South Korea","Coreia do Sul","Corée du Sud","Corea del Sud","Corea del Sur","https://upload.wikimedia.org/wikipedia/commons/thumb/0/09/Flag_of_South_Korea.svg/250px-Flag_of_South_Korea.svg.png","South Korea, officially the Republic of Korea, is a country in East Asia. It constitutes the southern half of the Korean Peninsula and borders North Korea along the Korean Demilitarized Zone, with the Yellow Sea to the west and the Sea of Japan to the east. South Korea claims to be the sole legitimate government of the entire peninsula and adjacent islands. It has a population of about 52 million, of which half live in the Seoul metropolitan area, the ninth most populous metropolitan area in the world, with other major cities being Busan, Daegu, and Incheon.","Coreia do Sul, oficialmente República da Coreia, também conhecida somente como Coreia é um país do Leste Asiático, localizado na parte sul da Península da Coreia. Sua única fronteira terrestre é com a Coreia do Norte, com a qual formou apenas um país até 1945. Faz fronteira a leste com o Mar do Japão, a sul com o Estreito da Coreia, que o separa do Japão, e a oeste com o Mar Amarelo. Seu território compreende a metade sul da península coreana, englobando cerca de três mil ilhas que a rodeiam, dentre as quais se destacam Jeju, Ulleungdo e os Rochedos de Liancourt. A capital e maior cidade do país é Seul, cuja área metropolitana é a segunda mais populosa do mundo.","La Corée du Sud, officiellement la république de Corée, est un État souverain d'Asie de l'Est. Il couvre la moitié sud de la péninsule coréenne et borde la Corée du Nord le long de la zone coréenne démilitarisée. Sa frontière occidentale est bordée par la mer Jaune, sa frontière orientale par la mer du Japon et sa frontière méridionale par le détroit de Corée. La république de Corée estime être le seul État légitime de toute la Corée et des îles adjacentes. Elle compte 52,2 millions d'habitants, dont environ la moitié vit dans la région de la capitale Séoul, qui constitue la quatrième aire métropolitaine la plus peuplée au monde. Les autres grandes villes comprennent Incheon, Pusan et Daegu.","La Corea del Sud, ufficialmente Repubblica di Corea è uno Stato dell'Asia orientale che occupa la metà meridionale della penisola coreana. Confina a nord con la Corea del Nord, a ovest con il Mar Giallo, a sud col Mar Cinese Orientale, a sud-est con lo stretto di Corea e a est con il Mar del Giappone. La capitale è Seul, che, con approssimativamente più di 10 milioni di persone nella sua area metropolitana, è una delle città più popolate del mondo. Con un paesaggio prevalentemente montuoso e 52 milioni di abitanti, la Corea del Sud è il ventesimo Paese più densamente popolato al mondo.","La República de Corea, comúnmente Corea del Sur, es un Estado soberano de Asia Oriental, ubicado en la parte sur de la península de Corea. Limita al norte con Corea del Norte, con la cual integró un solo país hasta 1945. Al este está ubicado el mar del Japón, al sur el estrecho de Corea, que lo separa de Japón, y al oeste el mar Amarillo. Su territorio comprende la mitad sur de la península de Corea, englobando unas tres mil islas que la rodean, entre las cuales se destacan Jeju, Ulleungdo y Dokdo.","Seoul","Seoul","51106229","100472","509","11 April 1919","Korean","South Korean|Korean","1931000000000","0.937","Korean Republic won","UTC|Korea Standard Time","+82",".kr.한국"
"KW","Kuwait","Kuwait","Koweït","Kuwait","Kuwait","https://upload.wikimedia.org/wikipedia/commons/thumb/a/aa/Flag_of_Kuwait.svg/250px-Flag_of_Kuwait.svg.png","Kuwait, officially the State of Kuwait, is a country in West Asia. With a coastline of approximately 500 km, it is situated at the head of the Persian Gulf in the northeastern edge of the Arabian Peninsula, bordering Iraq to the north and Saudi Arabia to the south. Kuwait is geographically the closest Gulf country to mainland Iran. The country is a small city-state; most of the population reside in the urban agglomeration of Kuwait City, the capital and largest city. As of 2024, Kuwait has a population of 4.82 million, of which 1.53 million are Kuwaiti citizens while the remaining 3.29 million are foreign nationals from over 100 countries. In 2024, Kuwait had the world's seventh largest number of foreign nationals as a percentage of the population, where its citizens make up fewer than 30% of the overall population.","Kuwait, oficialmente Estado do Kuwait, é um emirado árabe soberano situado no nordeste da península Arábica na Ásia Ocidental. Faz fronteira com a Arábia Saudita ao sul e ao norte com o Iraque. Encontra-se na costa noroeste do Golfo Pérsico. O nome Kuwait é derivado do árabe ""akwat"", o plural de ""Kout"", que significa ""fortaleza construída perto da água"". O emirado tem uma área de 17 820 km² e tem uma população de cerca de 2,7 milhões de habitantes.","Le Koweït, en forme longue l'État du Koweït, est un pays d'Asie occidentale et du Moyen-Orient. Situé au nord-est de la péninsule arabique, aux abords du golfe Persique, il partage ses frontières avec l'Arabie saoudite et l'Irak.","Il Kuwait, ufficialmente Stato del Kuwait, è un paese arabo del Medio Oriente affacciato sul golfo Persico; confina con l'Arabia Saudita a sud e con l'Iraq a nord. Rappresenta uno degli Stati più ricchi al mondo, forte della sua industria petrolifera.","Kuwait, cuyo nombre oficial es Estado de Kuwait, es un país árabe situado en Asia Occidental, en el extremo noreste de la península arábiga y en la punta norte del golfo Pérsico, donde comparte fronteras con Irak por el norte y con Arabia Saudita por el sur. Su nombre es un diminutivo en árabe de la palabra كوت kūt, que significa «fortaleza». El país tiene 17 818 km² de superficie y en 2024 tenía una población de 4,93 millones de habitantes.","Kuwait City","Kuwait City","4985716","17818","200.2","semi-constitutional monarchy","Arabic","Kuwaiti","153100000000","0.852","Kuwaiti dinar","UTC|AST","+965",".kw"
"KZ","Kazakhstan","Cazaquistão","Kazakhstan","Kazakistan","Kazajistán","https://upload.wikimedia.org/wikipedia/commons/thumb/d/d3/Flag_of_Kazakhstan.svg/250px-Flag_of_Kazakhstan.svg.png","Kazakhstan, officially the Republic of Kazakhstan, is a landlocked country situated primarily in Central Asia, with a portion of its territory extending into Eastern Europe. It borders Russia to the north and west, China to the east, Kyrgyzstan to the southeast, Uzbekistan to the south, and Turkmenistan to the southwest, and it has a coastline along the Caspian Sea. The capital is Astana and the country's largest city and principal cultural and economic center is Almaty, which served as the capital until 1997.","O Cazaquistão, oficialmente República do Cazaquistão, é um país transcontinental, localizado na Ásia Central, com uma pequena parte a oeste do rio Ural na Europa. É o maior país sem costa marítima do mundo e o nono maior do planeta; o seu território de 2 724 900 quilômetros quadrados é maior do que a área da Europa Ocidental. O Cazaquistão tem fronteiras com Rússia, China, Quirguistão, Uzbequistão e Turcomenistão, e, ainda, detém uma grande parte litorânea do mar Cáspio. O terreno do país inclui planícies, estepes, taiga, desfiladeiros de rochas, montanhas, deltas, montanhas cobertas de neve e desertos. Com uma estimativa de 18,7 milhões de habitantes, o Cazaquistão é classificado como o 63º país mais populoso do mundo, embora sua densidade populacional esteja entre as mais baixas, com 6 pessoas por km². A capital cazaque é Astana, depois que foi transferida de Almati, em 1997.","Le Kazakhstan, en forme longue la république du Kazakhstan, est un pays d'Asie centrale dont l'extrèmité occidentale se situe en Europe. Il borde la Russie au nord et à l'ouest, la Chine à l'est, le Kirghizistan au sud-est, l'Ouzbékistan au sud et le Turkménistan au sud-ouest, avec un littoral le long de la mer Caspienne. Sa capitale est Astana, tandis que sa plus grande ville et son principal pôle culturel et commercial est Almaty.","Il Kazakistan, ufficialmente Repubblica del Kazakistan, o più raramente in italiano Cosacchia, è uno Stato transcontinentale a cavallo tra Asia ed Europa; i territori geograficamente asiatici costituiscono la maggior parte del paese. La sua capitale è Astana e la sua città più popolosa è Almaty.","Kazajistán oficialmente República de Kazajstán, es un país transcontinental, con la mayor parte de su territorio situado en Asia Central y una menor parte su territorio al oeste del río Ural, en Europa Oriental. Con una superficie de 2 724 900 km², es el noveno país más grande del mundo, así como el Estado sin litoral marítimo más extenso del mundo. Kazajistán es uno de los seis Estados túrquicos independientes junto a Azerbaiyán, Turquía, Kirguistán, Turkmenistán y Uzbekistán; comparte fronteras con los tres últimos y con Rusia y China, a la vez que posee costas en el mar Caspio y el mar de Aral. La capital fue trasladada en 1997 de Almaty, la ciudad más poblada del país, a Astaná. Kazajistán pertenece a la región natural denominada Asia Central, formada además, junto con Tayikistán, por tres de los países ya citados, Kirguistán, Uzbekistán y Turkmenistán.","Astana","Almaty","20547909","2724900","7.44","semi-presidential republic","Kazakh Russian","Kazakh|Kazakhstani","360456000000","0.837","Tenge","UTC|+5","+7",".kz.қаз"
"LA","Laos","Laos","Laos","Laos","Laos","https://upload.wikimedia.org/wikipedia/commons/thumb/5/56/Flag_of_Laos.svg/250px-Flag_of_Laos.svg.png","Laos, officially the Lao People's Democratic Republic, is a country in Mainland Southeast Asia, and the only landlocked country in Southeast Asia. It is bordered by Myanmar and China to the northwest, Vietnam to the east, Cambodia to the southeast, and Thailand to the west and southwest. Having a population of more than 6 million, Laos's capital and most populous city is Vientiane. Laos has three UNESCO World Heritage Sites: the town of Luang Prabang, the temple complex of Vat Phou, and the Plain of Jars. The 2021 completion of the Boten–Vientiane railway, Laotian section of the Laos–China Railway, connects Vientiane to Kunming.","O Laos, oficialmente República Democrática Popular do Laos, é um país do Sudeste Asiático, localizado na Indochina e limitado a norte pela China, a leste pelo Vietnã, a sul pelo Camboja, a sul e oeste pela Tailândia e a noroeste por Myanmar. Sua população foi estimada em 6,5 milhões de habitantes em 2012.","Le Laos, en forme longue la République démocratique populaire lao, également sous la forme république démocratique populaire du Laos est un pays sans accès à la mer d'Asie du Sud-est, entouré par la Birmanie et la Chine au nord-ouest, la Thaïlande à l'ouest, le Cambodge au sud et le Viêt Nam à l'est. La capitale est Vientiane qui est aussi la ville la plus peuplée du pays, la langue officielle le lao, la monnaie officielle le kip.","Il Laos, ufficialmente Repubblica Popolare Democratica del Laos, è uno Stato del sud-est asiatico che non ha sbocco sul mare. Confina a nord con la Cina, a est con il Vietnam, a sud con la Cambogia, a ovest con la Thailandia e a nord-ovest con la Birmania, da cui è diviso dal fiume Mekong.","Laos, oficialmente República Democrática Popular Lao, es un Estado soberano situado en la península de Indochina. Limita con Myanmar y China al noroeste, Vietnam al este, Camboya al sureste, y Tailandia al oeste y suroeste, y es el único país sin salida al mar en el Sudeste Asiático. Su capital y ciudad más poblada es Vientián. Posee una superficie de 236 800 km² y una población estimada en 2016 de 6 758 353 habitantes, siendo con diferencia el menos poblado de los 5 países que conforman la península de Indochina.","Vientiane","Vientiane","6740000","236800","28.46","communist state","Lao","Laotian","16320000000","0.617","Kip","UTC|ICT","+856",".la"
"LB","Lebanon","Líbano","Liban","Libano","Líbano","https://upload.wikimedia.org/wikipedia/commons/thumb/5/59/Flag_of_Lebanon.svg/250px-Flag_of_Lebanon.svg.png","Lebanon, officially the Lebanese Republic, is a country in the Levant region of West Asia. Situated at the crossroads of the Mediterranean Basin and the Arabian Peninsula, it is bordered by Syria to the north and east, Israel to the south, and the Mediterranean Sea to the west; Cyprus lies a short distance from the coastline. Lebanon has a population of more than five million and an area of 10,452 square kilometres. Beirut is the country's capital and largest city.","Líbano, oficialmente República do Líbano é um país localizado na extremidade leste do mar Mediterrâneo, na Ásia Ocidental, numa região que faz ligação entre esse continente e a Europa. Faz fronteira com a Síria ao norte e a leste e com Israel ao sul e a oeste. No cruzamento da bacia do Mediterrâneo, o Líbano é uma das regiões de antigas civilizações, como fenícios, assírios, persas, gregos, romanos, bizantinos e turcos otomanos, sendo que sua rica história formou a identidade cultural única em diversidade étnica e religiosa do país.","Le Liban, en forme longue la République libanaise, est un État d'Asie situé au Proche-Orient. En grande partie montagneux, il partage ses frontières avec la Syrie au nord et à l'est sur 376 km, Israël au sud sur 79 km et Chypre à l'ouest, à environ 200 km au large de ses 255 km de côtes dans le bassin Levantin. Beyrouth est la capitale et la plus grande ville du pays. Il est l’un des six États fondateurs de la ligue arabe.","Il Libano, ufficialmente Repubblica del Libano, è uno Stato del Vicino Oriente affacciato sul Mar Mediterraneo. Il Libano confina a nord e a est con la Siria e a sud con Israele, a ovest si affaccia sul Mar Mediterraneo. Il territorio del paese è prevalentemente montuoso ed è dominato in particolare dal monte Libano; il clima è prevalentemente di tipo mediterraneo.","El Líbano, oficialmente la República Libanesa, es un país árabe de Asia Occidental, localizado en el Levante mediterráneo. Limita al sur con Israel, al norte y al este con Siria, y al oeste con el mar Mediterráneo. El país se ubica entre la península arábiga y la cuenca del Mediterráneo. Su capital y ciudad más poblada es Beirut. Posee una extensión territorial de 10 450 km², siendo uno de los países más pequeños del mundo.","Beirut","Beirut","5364482","10452","513","Unitary parliamentary republic|confessionalism","Arabic","Lebanese","21780000000","0.752","Lebanese pound","UTC|EET","+961",".lb.لبنان"
"LC","Saint Lucia","Santa Lúcia","Sainte-Lucie","Saint Lucia","Santa Lucía","https://upload.wikimedia.org/wikipedia/commons/thumb/9/9f/Flag_of_Saint_Lucia.svg/250px-Flag_of_Saint_Lucia.svg.png","Saint Lucia is an island country in the eastern Caribbean. Part of the Windward Islands of the Lesser Antilles, it is located north/northeast of the island of Saint Vincent, northwest of Barbados and south of Martinique. It covers a land area of 617 km with an officially estimated population of over 184,100 people as of mid 2023. The nation's capital and largest city is Castries.","Santa Lúcia é um país insular das Pequenas Antilhas, no Caribe, próximo à Martinica, São Vicente e Granadinas e Barbados. Seu nome foi dado por Cristóvão Colombo, que ali esteve, em 1502.","Sainte-Lucie est un État insulaire des Antilles.","Saint Lucia o Santa Lucia è uno stato insulare del Commonwealth in America centrale, tra il Mar dei Caraibi orientale e l'oceano Atlantico; si trova nelle Piccole Antille, a nord di Saint Vincent e Grenadine e a sud della Martinica.","Santa Lucía es un país insular de América, ubicado en el mar Caribe, al norte de San Vicente y las Granadinas y al sur de la isla de la Martinica. Cubre una superficie terrestre de 617 km² con una población estimada de 183 629 habitantes en el año 2020. La capital y ciudad más grande de la nación es Castries, donde vive más de un tercio de la población total. Santa Lucía es una de las islas de Barlovento, el nombre proviene de Santa Lucía de Siracusa.","Castries","Castries","184100","617","298","constitutional monarchy","English","Saint Lucian","2715000000","0.748","East Caribbean dollar","UTC|AST","+1",".lc"
"LI","Liechtenstein","Liechtenstein","Liechtenstein","Liechtenstein","Liechtenstein","https://upload.wikimedia.org/wikipedia/commons/thumb/4/47/Flag_of_Liechtenstein.svg/250px-Flag_of_Liechtenstein.svg.png","Liechtenstein, officially the Principality of Liechtenstein, is a doubly landlocked country in the Central European Alps. It is located between Austria to the east and north-east and Switzerland to the north-west, west and south.","Liechtenstein ou Listenstaine, oficialmente Principado de Liechtenstein ou do Liechtenstein, é um microestado principado localizado no centro da Europa, encravado nos Alpes entre a Áustria, a leste, e a Suíça a oeste. Pouco mais de 39 000 habitantes moram nos seus 160,477 km² segundo algumas estimativas.","Le Liechtenstein, en forme longue la principauté du Liechtenstein ou Principauté de Liechtenstein, est un pays alpin d'Europe centrale, sans accès à la mer, bordé par la Suisse à l'ouest et au sud et par l'Autriche à l'est et au nord. Sa superficie est de 160 km, avec une population estimée à un peu plus de 39 000 habitants. Sa capitale est Vaduz et sa plus grande ville est Schaan. En 2017, selon The World Factbook, le Liechtenstein possède l'un des plus hauts PIB par habitant. Le pays a également l'un des taux de chômage les plus bas au monde. Le Liechtenstein est le plus petit et le plus riche des pays germanophones.","Il Liechtenstein, ufficialmente Principato del Liechtenstein è uno Stato dell'Europa centrale racchiuso tra Svizzera e Austria. Rappresenta uno dei Paesi più piccoli al mondo. Il principato è di lingua tedesca, lingua parlata in diglossia con il tedesco alemanno. Nato come principato del Sacro Romano Impero, il Liechtenstein costituisce una monarchia costituzionale, nonché uno dei Paesi più ricchi al mondo con un forte settore finanziario.","Liechtenstein, oficialmente Principado de Liechtenstein, es un micro-Estado centroeuropeo sin litoral cuya forma de gobierno es la monarquía constitucional, ubicado entre Suiza y Austria en la orilla oriental del Rin. El idioma oficial es el alemán, pero en la vida cotidiana se habla principalmente el dialecto alemánico, con variaciones claramente locales. La capital es Vaduz y su ciudad más poblada es Schaan.","Vaduz","Vaduz","41237","160.5","249","constitutional monarchy|direct democracy","German","Liechtensteiner","8288000000","0.938","Swiss franc","UTC|CET","+423",".li"
"LK","Sri Lanka","Sri Lanka","Sri Lanka","Sri Lanka","Sri Lanka","https://upload.wikimedia.org/wikipedia/commons/thumb/1/11/Flag_of_Sri_Lanka.svg/250px-Flag_of_Sri_Lanka.svg.png","Sri Lanka, officially the Democratic Socialist Republic of Sri Lanka, formerly known as Ceylon, is an island country in South Asia. It is located in the Indian Ocean, southwest of the Bay of Bengal, and is separated from India by the Gulf of Mannar and the Palk Strait. Sri Lanka shares a maritime border with the Maldives to the southwest and India to the northwest, and lies across the Bay of Bengal from Bangladesh and Myanmar to the northeast and the Andaman and Nicobar Islands of India to the east. Its capital is Sri Jayawardenepura Kotte, while Colombo is its largest city and the political, financial and cultural centre. Sri Lanka's population is 22 million; with the Sinhalese people, who speak the Sinhala language, forming the vast majority—while Tamil is spoken by the large Tamil minority. Other long-established ethnic groups include the Moors, Indian Tamils, Burghers, Malays, Chinese, and Vedda.","O Sri Lanka, Sri Lanca ou Seri Lanca, oficialmente República Socialista Democrática do Sri Lanka; conhecido pela forma portuguesa equivalente Ceilão, adotada pelo país até 1972; era chamado de Taprobana na Antiguidade e na Idade Média, é um país insular asiático, localizado ao largo da extremidade sul do subcontinente indiano. Tem costas para a baía de Bengala a leste, oceano Índico a sul e a oeste, e o estreito de Palk a noroeste, que o separa da Índia. A sua capital é Seri Jaiavardenapura-Cota, subúrbio da antiga capital Colombo, desde a inauguração do novo edifício do parlamento, em 1982.","Le Sri Lanka, en forme longue la république socialiste démocratique de Sri Lanka, est un État insulaire de 65 610 km du sous-continent indien, situé au sud-est de l'Inde et à l'est des Maldives, et peuplé d'environ vingt-deux millions d'habitants.","Lo Sri Lanka, ufficialmente Repubblica Democratica Socialista dello Sri Lanka, fino al 1972 ufficialmente Ceylon, è uno Stato insulare che si trova in Asia meridionale e occupa l'omonima isola al largo della costa sud-orientale del subcontinente indiano, tra il Mar delle Laccadive e il golfo del Bengala. Per la sua forma particolare e la sua vicinanza alla costa indiana è stata soprannominata Lacrima dell'India. È parte del Commonwealth britannico. L'attuale capitale Sri Jayawardenapura Kotte, sede del parlamento dello Sri Lanka, è situata nell'area metropolitana dell'ex capitale Colombo, che è la più grande e popolata città del Paese e mantiene, ad oggi, alcuni ministeri e tutte le ambasciate.","Sri Lanka, oficialmente la República Socialista Democrática de Sri Lanka, es un país soberano insular de Asia del Sur, cuya forma de gobierno es la república semipresidencialista. Su territorio está organizado en nueve provincias y veinticuatro distritos. Sus capitales son Kotte, que alberga la sede del poder legislativo, y Colombo, que alberga la sede de los poderes ejecutivo y judicial, siendo esta última la ciudad más poblada y sede del gobierno del país.","Sri Jayawardenepura Kotte|Colombo","Colombo","21756000","67240","337.7","semi-presidential republic","Sinhala|Tamil","Sri Lankan","108800000000","0.776","Rs","UTC|SLST","+94",".lk.ලංකා.இலங்கை"
"LR","Liberia","Libéria","Liberia","Liberia","Liberia","https://upload.wikimedia.org/wikipedia/commons/thumb/b/b8/Flag_of_Liberia.svg/250px-Flag_of_Liberia.svg.png","Liberia, officially the Republic of Liberia, is a country on the West African coast. It is bordered by Sierra Leone to its northwest, Guinea to its north, Ivory Coast to its east, and the Atlantic Ocean to its south and southwest. It has a population of around 5.5 million and covers an area of 43,000 square miles. The official language is English, though over 20 indigenous languages are spoken, reflecting the country's ethnic and cultural diversity. The capital and largest city is Monrovia.","A Libéria, oficialmente República da Libéria, é uma república presidencialista localizada na África Ocidental. Faz fronteira ao norte com a Serra Leoa e Guiné, a leste com a Costa do Marfim e a sul e oeste com o Oceano Atlântico. Segundo o censo de 2008, a população do país é de 3 955 000 habitantes, divididos em uma área de 111 369 km. A cidade de Monróvia é sua capital. A Libéria possui um clima quente equatorial, com chuvas intensas na estação chuvosa e ventos na estação seca. A vegetação é composta, na maior parte, por florestas de mangue, enquanto o interior é escassamente povoado de florestas, com predominância de pastagens secas.","Le Liberia ou Libéria, en forme longue la république du Liberia ou république du Libéria, est un pays d'Afrique de l'Ouest bordé au sud-sud-est et à l'ouest-sud-ouest par l'océan Atlantique, au nord-ouest par la Sierra Leone, au nord par la Guinée et à l’est par la Côte d'Ivoire. La population de la république du Libéria est de 5 819 593 en 2026.","La Liberia, ufficialmente Repubblica di Liberia, è uno Stato dell'Africa occidentale, confinante a nord con Sierra Leone e Guinea e a est con la Costa d'Avorio. Tra la fine del XX secolo e l'inizio del XXI, la Liberia è stata afflitta da due guerre civili che hanno reso profughi centinaia di migliaia di cittadini e ne hanno distrutto l'economia. La sua capitale è Monrovia.","Liberia, oficialmente la República de Liberia, es un país ubicado en la costa oeste de África y que limita con Sierra Leona al noroeste, Costa de Marfil al este y Guinea al norte. Por el sur y el oeste limita con el golfo de Guinea, parte del océano Atlántico, en el punto más cercano del continente africano con Sudamérica, de la cual dista unos 2 840 km. Abarca 111 369 km² de superficie y cuenta con una población de 4 294 000 habitantes. Su lengua oficial es el inglés aunque también se hablan alrededor de treinta lenguas indígenas, de las que destacan el kpelle, bassa, vai, grebo, craví, guisí, gola y el criollo «inglés liberiano».","Monrovia","Monrovia","5437249","111370","35.5","presidential republic","English","Liberian","5170000000","0.51","United States dollar|Liberian dollar","UTC|GMT","+231",".lr"
