isoCode,name_en,name_pt,name_fr,name_it,name_es,flagUrl,description_en,description_pt,description_fr,description_it,description_es,capital,largestCity,population,areaKm2,densityKm2,government,officialLanguage,demonym,gdp,hdi,currency,timeZone,callingCode,internetTld
"PH","Philippines","Filipinas","Philippines","Filippine","Filipinas","https://upload.wikimedia.org/wikipedia/commons/thumb/9/99/Flag_of_the_Philippines.svg/250px-Flag_of_the_Philippines.svg.png","The Philippines, officially the Republic of the Philippines, is an archipelagic country in Southeast Asia. Located in the western Pacific Ocean, it consists of about 7,641 islands, with a total area of about 300,000 square kilometers, which are broadly categorized in three main geographical divisions from north to south: Luzon, Visayas, and Mindanao. With a population of over 114 million, it is the world's twelfth-most-populous country.","Filipinas, oficialmente República das Filipinas, é um país localizado no Arquipélago Malaio, no Sudeste Asiático. O arquipélago é delimitado pelo Mar das Filipinas a leste, Mar de Celebes e Mar de Sulu a sul e Mar da China Meridional a oeste. O Estreito de Luzon, a norte, separa as Filipinas de Taiwan, o Estreito de Balabac, a sudoeste, é uma das fronteiras marítimas com a Malásia, e há também fronteira marítima com a Indonésia, a sul, através do Mar de Celebes, e com o Vietnã, através do Mar da China Meridional. Também Palau se situa nas imediações, para sudeste. A sua capital é Manila, enquanto sua cidade mais populosa é Cidade Quezon, ambas fazendo parte da Região Metropolitana de Manila. O país é composto por 7 641 ilhas, que são categorizadas amplamente em três principais divisões geográficas: Luzon, Visayas e Mindanau. Com aproximadamente 300 000 km, as Filipinas são o 72º maior país do mundo.","Les Philippines, en forme longue la république des Philippines, est un pays d'Asie du Sud-Est constitué d'un archipel de 7 641 îles dont onze totalisent plus de 90 % des terres et dont un peu plus de 2 000 seulement sont habitées, alors qu'environ 2 400 îles n'ont même pas reçu de nom.","Le Filippine, ufficialmente Repubblica delle Filippine, sono uno Stato insulare del Sud-est asiatico situato nel confine tra il Mar cinese Meridionale e l'oceano Pacifico; a metà strada tra il Vietnam e Palau; a nord è separato da Taiwan dallo stretto di Luzon, a ovest è bagnato dal mar Cinese Meridionale, a sud-ovest dal mare di Sulu verso il Borneo, a sud dal mar di Celebes che lo separa dalle altre isole dell'Indonesia e a est dal mar delle Filippine. La posizione nei pressi della cintura di fuoco del Pacifico e il clima tropicale fanno delle Filippine un'area frequentemente colpita da terremoti e tifoni, di cui alcuni anche molto violenti, come il tifone Yolanda, che nel 2013 provocò la morte di circa 8 000 persone. Le Filippine sono anche ricche di risorse naturali e sono una delle aree più ricche di biodiversità del mondo.","Filipinas —oficialmente la República de Filipinas — es un país insular situado en el Sudeste Asiático, sobre el océano Pacífico. Su capital es Manila y su ciudad más poblada es la Ciudad Quezón. Al norte se encuentra separado de la isla de Taiwán por el estrecho de Luzón; al oeste se halla el mar de la China Meridional y Vietnam; al suroeste, Borneo; al sur, el mar de Célebes lo separa de otras islas de Indonesia, y al este limita con el mar de Filipinas. Su ubicación en el cinturón de fuego del Pacífico y su clima tropical lo convierten en un lugar propenso a terremotos y tifones. El país es rico en recursos naturales y se encuentra en una de las zonas con mayor biodiversidad del mundo. Está formado por 7.107 islas que se clasifican geográficamente en tres grupos: Luzón, las Bisayas y Mindanao.","Manila","Quezon City","112729484","300000","363.45","November 15, 1935","Filipino|English","Filipino|Filipina (|Pinoy|Pinay (|Philippine (","512222000000","0.72","Philippine peso|₱","UTC|PhST","+63",".ph"
"PK","Pakistan","Paquistão","Pakistan","Pakistan","Pakistán","https://upload.wikimedia.org/wikipedia/commons/thumb/3/32/Flag_of_Pakistan.svg/250px-Flag_of_Pakistan.svg.png","Pakistan, officially the Islamic Republic of Pakistan, is a country in South Asia. It is the fifth-most populous country, with a population of over 241.5 million, having the second-largest Muslim population as of 2023. Islamabad is the nation's capital, while Karachi is its largest city and financial centre. Pakistan is the 33rd-largest country by area. Bounded by the Arabian Sea on the south, the Gulf of Oman on the southwest, and the Sir Creek on the southeast, it shares land borders with India to the east; Afghanistan to the west; Iran to the southwest; and China to the northeast. It shares a maritime border with Oman in the Gulf of Oman, and is separated from Tajikistan in the northwest by Afghanistan's narrow Wakhan Corridor.","Paquistão, oficialmente República Islâmica do Paquistão, é um país soberano do Sul da Ásia. Com uma população superior a 200 milhões de pessoas, é o quinto país mais populoso do mundo e, com uma área de 796 095 quilômetros quadrados, é a 35ª maior nação do planeta em área territorial. O Paquistão tem um litoral com 1 046 km de extensão ao longo do Mar da Arábia e do Golfo de Omã. O país asiático faz fronteira com a Índia a leste, com o Afeganistão a oeste e norte, com o Irã a sudoeste e com a República Popular da China no extremo nordeste. O Paquistão não tem fronteira com o Tajiquistão, pois estão separados pelo estreito Corredor de Wakhan, pertencente ao Afeganistão, no norte. Também compartilha uma fronteira marítima com Omã.","Le Pakistan, en forme longue la république islamique du Pakistan, est un pays d'Asie du Sud entouré par l'Iran, l'Afghanistan, la Chine, l'Inde et la mer d'Oman. Fondé le 14 août 1947 au terme de la partition des Indes sous la forme d'un État constitué de deux parties séparées par près de 1 600 km de territoire indien, avec comme dénominateur commun la religion musulmane, le pays se trouve réduit à sa partie occidentale en 1971 au terme de la guerre d'indépendance du Bangladesh. Depuis sa création, il entretient des relations tendues avec l'Inde en raison de prétentions territoriales concurrentes sur le Cachemire, les deux pays s'étant affrontés à travers trois guerres successives. En revanche, le Pakistan est un allié des États-Unis et entretient des relations cordiales avec la Chine. Le pays dispose de l'arme nucléaire après avoir fait des essais officiels en 1998.","Il Pakistan o Pachistan, ufficialmente Repubblica Islamica del Pakistan, è uno Stato dell'Asia meridionale, il quinto più popoloso al mondo, con una popolazione superiore ai 252 milioni di abitanti ed il 35º più esteso con 796 096 km². A sud ha una costa che si estende per 1 046 chilometri sul Mar Arabico e sul golfo di Oman, a est confina con l'India, a ovest con l'Afghanistan, mentre con l'Iran e la Cina confina rispettivamente a sud-ovest e all'estremo nord-est. A nord è separato dal Tagikistan dal corridoio del Wakhan dell'Afghanistan, mentre condivide anche un confine marittimo con l'Oman. La capitale è Islamabad.","Pakistán o Paquistán, oficialmente República Islámica de Pakistán, es un Estado soberano de Asia ubicado en Oriente Medio y el subcontinente indio que comparte fronteras con Afganistán al norte y noroeste, con Irán al oeste, con la India al este y con China al noreste, mientras que hacia el sur posee unos 1046 km de costa bañada por el mar Arábigo y el golfo de Omán, en el océano Índico. El corredor afgano de Vaján lo separa de Tayikistán en el norte. Con más de 240 millones de habitantes según el censo oficial llevado a cabo a partir de marzo de 2023, Pakistán es el quinto país más poblado del mundo, así como uno de los más densamente poblados.","Islamabad","Karachi","241499431","881913","273.8","Federal|Islamic republic","Urdu|English","Pakistani","407790000000","0.544","Pakistani rupee","UTC|PKT","+92",".pkپاکستان."
"PL","Poland","Polónia","Pologne","Polonia","Polonia","https://upload.wikimedia.org/wikipedia/en/thumb/1/12/Flag_of_Poland.svg/250px-Flag_of_Poland.svg.png","Poland, officially the Republic of Poland, is a country in Central Europe. It extends from the Baltic Sea in the north to the Sudetes and Carpathian Mountains in the south, and borders Lithuania and Russia to the northeast; Belarus and Ukraine to the east; Slovakia and the Czech Republic to the south; and Germany to the west. The territory has a varied landscape, diverse ecosystems, and a temperate climate. Poland is composed of sixteen voivodeships and is the fifth most populous member state of the European Union, with over 38 million people, and the fifth largest EU country by land area, covering 312,696 km. The capital and largest city is Warsaw; other major cities include Kraków, Wrocław, Łódź, Poznań, and Gdańsk.","Polónia ou Polônia, oficialmente República da Polónia, é um país da Europa Central que tem fronteiras comuns com a Alemanha a oeste; com a Chéquia e a Eslováquia ao sul; com a Ucrânia e a Bielorrússia a leste; com o Mar Báltico, o Oblast de Kaliningrado e a Lituânia ao norte. A área total da nação é 312 679 quilômetros quadrados, o que a torna o 69.º maior país do mundo e o 9.º maior da Europa. Com uma população de mais de 38,5 milhões de pessoas, a Polônia é o 34.º país mais populoso do mundo, o quinto membro mais populoso da União Europeia e o Estado pós-comunista mais populoso da UE. A Polônia é um Estado unitário dividido em 16 voivodias.","La Pologne, en forme longue république de Pologne, est un État d'Europe centrale, frontalier avec l'Allemagne à l'ouest, la Tchéquie au sud-ouest, la Slovaquie au sud, l'Ukraine à l'est-sud-est et la Biélorussie à l'est-nord-est, et enfin l'enclave russe de Kaliningrad et la Lituanie au nord-est.","La Polonia, ufficialmente Repubblica di Polonia, è uno Stato situato nell'Europa centrale, membro dell'Unione europea, della NATO e dell'ONU. La Polonia ha una popolazione di 38 036 118 abitanti e una superficie di 312696 km². La città principale, nonché capitale, è Varsavia. Confina a ovest con la Germania, a sud con la Repubblica Ceca e la Slovacchia, a est con l'Ucraina e la Bielorussia, a nordest con la Lituania e con l'exclave russa di Kaliningrad; a nord è bagnata dal mar Baltico.","Polonia, oficialmente la República de Polonia, es un país de Europa Central, uno de los veintisiete Estados soberanos que forman la Unión Europea, constituido en Estado democrático de derecho y cuya forma de gobierno es la república parlamentaria. Es un Estado unitario con 16 subdivisiones o regiones administrativas denominadas voivodatos.","Warsaw","Warsaw","37314000","312696","126","17 September 1939","Polish","Polish|Pole","1134000000000","0.906","Złoty","UTC|CET","+48",".pl"
"PS","Palestine","Estado da Palestina","Palestine (État)","Stato di Palestina","Palestina","https://upload.wikimedia.org/wikipedia/commons/thumb/0/00/Flag_of_Palestine.svg/250px-Flag_of_Palestine.svg.png","Palestine, officially the State of Palestine, is a country in West Asia. It encompasses the Israeli-occupied West Bank, including East Jerusalem, and the Gaza Strip, collectively known as the Palestinian territories, or occupied Palestinian territory. The territories share the vast majority of their borders with Israel, with the West Bank bordering Jordan to the east and the Gaza Strip bordering Egypt to the southwest. It has a total land area of 6,020 square kilometers while its population exceeds five million. Its proclaimed capital is Jerusalem, while Ramallah serves as its de facto administrative center. Gaza was its largest city prior to evacuations in 2023.","Palestina, oficialmente Estado da Palestina, é um país de reconhecimento limitado situado no Oriente Médio. Reconhecido por 157 dos 193 Estados-membros da ONU, o país abrange a Cisjordânia ocupada por Israel e a Faixa de Gaza, incluíndo Jerusalém Oriental, que são coletivamente conhecidos como territórios palestinos ocupados, dentro da região geográfica e histórica mais ampla da Palestina. A Palestina designa Jerusalém Oriental como sua capital, mas seu centro administrativo está localizado na cidade de Ramala. A sua independência foi declarada em 15 de novembro de 1988 pela Organização para a Libertação da Palestina e por seu governo no exílio em Argel, na Argélia. No entanto, a maioria das áreas reivindicadas pelos palestinos estão ocupadas por Israel desde a Guerra dos Seis Dias, em 1967. Após a Segunda Guerra Mundial, em 1947, as Nações Unidas adotaram um Plano para Partilha da Palestina, recomendando a criação de dois estados árabe e judeu independentes, com uma Jerusalém internacionalizada. Em 1993, os Acordos de Oslo estabeleceram a Autoridade Nacional Palestina, que realiza a administração sociopolítica de áreas delimitadas dos territórios, enquanto o Hamas controla a Faixa de Gaza.","La Palestine, en forme longue l'État de Palestine, est un État souverain de jure et un proto-État de facto. Situé au Proche-Orient, l'État de Palestine est présent sur les territoires palestiniens occupés et revendique la bande de Gaza, Jérusalem-Est et l'entièreté de la Cisjordanie, soit 23 % de la Palestine historique, mais il est soumis depuis sa fondation entre 1988 et 1997 à une forte instabilité administrative et territoriale. Ses frontières sont, de facto et depuis les accords d'Oslo signés en 1994, celles des zones A et B de la Cisjordanie, gouvernée partiellement par l'Autorité palestinienne, et celles de la bande de Gaza, sous contrôle du Hamas depuis 2007 mais revendiquée par l'Autorité palestinienne. Sa capitale est de jure Jérusalem, cependant le siège du gouvernement palestinien se situe de facto à Ramallah en raison de l'annexion de Jérusalem-Est par Israël.","La Palestina, ufficialmente Stato di Palestina, è uno Stato a riconoscimento limitato situato nel Medio Oriente, osservatore permanente presso le Nazioni Unite, de facto in gran parte occupato da Israele. Lo Stato di Palestina rivendica sovranità sui territori palestinesi della Cisgiordania e della Striscia di Gaza, con Gerusalemme Est come capitale designata, sebbene il suo centro amministrativo si trovi a Ramallah. Tali territori sono stati prima occupati nel 1948 da Giordania ed Egitto e successivamente da Israele dal 1967 a seguito della guerra dei sei giorni. La Palestina ha una popolazione di 5 051 953 abitanti a febbraio 2020, al 121º posto nel mondo.","Palestina, oficialmente Estado de Palestina, es un país de Asia ubicado en la región de Oriente Próximo, más concretamente en el Levante mediterráneo, que consta de las regiones de Cisjordania y la Franja de Gaza, con Jerusalén Este como capital. Con una superficie de 6520 km², se organiza como una república presidencialista y consta de un total de dieciséis gobernaciones. Limita con los territorios ocupados por Israel, Jordania al este, Egipto al sur y con la ribera sudoriental del mar Mediterráneo al oeste.","Jerusalem|limited recognition|Ramallah","Gaza","5483450","6020","731","semi-presidential republic","Arabic","Palestinian","18109000000","0.674","Israeli new shekel|Jordanian dinar|Egyptian pound","UTC|Palestine Standard Time","+970|+972",".ps"
"PT","Portugal","Portugal","Portugal","Portogallo","Portugal","https://upload.wikimedia.org/wikipedia/commons/thumb/a/a8/Flag_of_Portugal_%28official%29.svg/250px-Flag_of_Portugal_%28official%29.svg.png","Portugal, officially the Portuguese Republic, is a country located on the Iberian Peninsula in Southwestern Europe. It is a unitary republic made up by mainland Portugal and two autonomous regions, with Lisbon as its capital and largest city. It has a population of over 10.7 million. The mainland includes the westernmost point of continental Europe and is bordered by Spain to the north and east; Madeira and the Azores are in the Atlantic Ocean.","Portugal, oficialmente República Portuguesa, é um país soberano unitário localizado no sudoeste da Europa, cujo território se situa na zona ocidental da Península Ibérica e em arquipélagos no Atlântico Norte. O território português tem uma área total de 92 090 km², sendo delimitado a norte e leste pela Espanha e a sul e oeste pelo oceano Atlântico, compreendendo uma parte continental e duas regiões autónomas: os arquipélagos dos Açores e da Madeira. Portugal é a nação mais a ocidente do continente europeu. O nome do país provém da sua segunda maior cidade, Porto, cujo nome latino-celta era Portus Cale.","Le Portugal, en forme longue la République portugaise, en portugais : República Portuguesa, est un État transcontinental d'Europe du Sud-Ouest, dont le territoire continental est situé dans l'ouest de la péninsule Ibérique, et dont le territoire insulaire est situé sur la plaque continentale africaine pour Madère, et à cheval sur les plaques européenne et nord-américaine pour les Açores. Délimité au nord et à l'est par l'Espagne, au sud par sa frontière maritime avec le Maroc et les Canaries espagnoles, et à l'ouest par l'océan Atlantique, ce pays est le plus occidental de l'Europe continentale. Fondé en 1143, c'est le plus vieil État-nation d'Europe et ses frontières terrestres internationales, établies au milieu du XIII siècle, sont parmi les plus anciennes encore en vigueur en Europe et dans le monde. Son expansion précoce dans l'Atlantique à partir du XV siècle lui permet de posséder au XXI siècle une zone d'exclusivité maritime de 1 727 408 km, soit dix-huit fois sa superficie terrestre, classée troisième ZEE de l'Union européenne, cinquième d'Europe et vingtième du monde.","Il Portogallo, ufficialmente Repubblica Portoghese, è uno Stato dell'Europa occidentale, membro dell'Unione europea. È collocato nella posizione più occidentale fra tutti gli Stati dell'Europa continentale.","Portugal, oficialmente la República Portuguesa, es un país soberano del suroeste de Europa, ubicado en la península ibérica. Es uno de los veintisiete Estados miembros de la Unión Europea. Su capital y ciudad más poblada es Lisboa. Limita al este y al norte con España, y al sur y al oeste con el océano Atlántico. Su territorio comprende también los archipiélagos autónomos de las Azores y Madeira, situados en el océano Atlántico Norte. Su punto más alto, la Montaña del Pico, alcanza los 2351 metros sobre el nivel del mar.","Lisbon","Lisbon","10749635","156597","116.6","semi-presidential republic","Portuguese","Portuguese","380637000000","0.89","Euro|€","UTC","+351",".pt"
"PW","Palau","Palau","Palaos","Palau (stato)","Palaos","https://upload.wikimedia.org/wikipedia/commons/thumb/4/48/Flag_of_Palau.svg/250px-Flag_of_Palau.svg.png","Palau, officially the Republic of Palau, is an island country located in the Micronesia subregion of Oceania in the western Pacific Ocean. The Republic of Palau consists of approximately 340 islands and is the western part of the Caroline Islands, while the eastern and central parts make up the Federated States of Micronesia.","Palau, oficialmente República de Palau é um pequeno país insular da Micronésia, no Oceano Pacífico, entre os mares das Filipinas a oeste e norte, Indonésia e Papua-Nova Guiné a sul e Estados Federados da Micronésia a leste e nordeste. Constituído por oito ilhas principais e diversos pequenos ilhéus e atóis.","Les Palaos, en forme longue la république des Palaos, sont un pays d'Océanie situé en Micronésie, à l'est de Mindanao, au nord de la Nouvelle-Guinée occidentale, à l'ouest des États fédérés de Micronésie et occupant l'extrémité occidentale de l'archipel des Carolines.","Palau, a volte scritto anche Belau, ufficialmente Repubblica di Palau, è uno Stato insulare nell'oceano Pacifico, situato a circa 500 km a est delle Filippine. Ha ottenuto l'indipendenza dagli Stati Uniti d'America nel 1994.","Palaos, oficialmente la República de Palaos, es un país insular, uno de los cuatro que forman Micronesia y uno de los catorce que conforman Oceanía. Su capital es Ngerulmud y su ciudad más poblada es Koror.","Ngerulmud","Koror","17663","459","38.375","presidential republic|non-partisan democracy","Palauan|English","Palauan","322000000","0.786","United States dollar","UTC","+680",".pw"
"PY","Paraguay","Paraguai","Paraguay","Paraguay","Paraguay","https://upload.wikimedia.org/wikipedia/commons/thumb/2/27/Flag_of_Paraguay.svg/250px-Flag_of_Paraguay.svg.png","Paraguay, officially the Republic of Paraguay, is a landlocked country located in the central region of South America. It borders Bolivia to the northwest and north, Brazil to the northeast and east, and Argentina to the southeast, south, and west. Paraguay has access to the Atlantic Ocean via the Paraná–Paraguay Waterway. The country is governed as a unitary presidential republic composed of a capital district and seventeen departments. Its capital and largest city is Asunción.","Paraguai, oficialmente República do Paraguai, é um país do centro da América do Sul, limitado a norte e oeste pela Bolívia, a nordeste e leste pelo Brasil e a sul e oeste pela Argentina. Possui uma área de 406 752 quilômetros quadrados, um pouco maior que o estado brasileiro de Mato Grosso do Sul. Segundo o último Censo em 2022, a população paraguaia foi de 6,1 milhões de habitantes, a maioria dos quais estão concentrados na região sudeste do país. Ao lado da Bolívia, o Paraguai é um dos dois países da América do Sul que não possuem uma saída para o mar.","Le Paraguay, en forme longue république du Paraguay depuis 1813, est un État souverain enclavé d'Amérique du Sud. Néanmoins, il dispose d'un accès à la mer via le rio Paraná qui se jette dans l'océan Atlantique. Le pays a des frontières terrestres avec l'Argentine, la Bolivie et le Brésil.","Il Paraguay, più raramente Paraguai, ufficialmente Repubblica del Paraguay è uno Stato sovrano dell'America meridionale. Con 406 750 km² di superficie totale, è uno Stato senza sbocco al mare. Ha 7 303 000 abitanti e la sua capitale è la città di Asunción.","Paraguay, oficialmente República del Paraguay, es un país soberano situado en el centro de Sudamérica con grandes extensiones de bosques, cataratas y humedales. Está organizado como un estado unitario, compuesto por una capital y diecisiete departamentos. Su capital es Asunción, una de las ciudades más antiguas de América. Su forma de gobierno es de república que se rige por el sistema presidencial y se organiza como un estado de derecho. Es miembro fundador de la ONU, la OEA, la OIM y el MERCOSUR.","Asunción","Asunción","6459886","406752","15.1","presidential republic","Spanish|Guarani","Paraguayan","60540000000","0.756","Guaraní","UTC|PYT","+595",".py"
"QA","Qatar","Catar","Qatar","Qatar","Catar","https://upload.wikimedia.org/wikipedia/commons/thumb/6/65/Flag_of_Qatar.svg/250px-Flag_of_Qatar.svg.png","Qatar, officially the State of Qatar, is a country in West Asia. It occupies the Qatar Peninsula on the northeastern coast of the Arabian Peninsula in the Middle East; it shares its sole land border with Saudi Arabia to the south, with the rest of its territory surrounded by the Persian Gulf. The Gulf of Bahrain, an inlet of the Persian Gulf, separates Qatar from nearby Bahrain. The capital is Doha, home to over 80% of the country's inhabitants. Most of the land area is made up of flat, low-lying desert.","Catar, ou Qatar, oficialmente Estado do Catar, é um país árabe do Sudoeste Asiático que ocupa a pequena península do Catar, na costa nordeste da península Arábica, no Oriente Médio. Sua única fronteira terrestre é com a Arábia Saudita ao sul, enquanto o restante de seu território é cercado pelo golfo Pérsico. Um estreito também separa a península do estado insular do Barém através do golfo do Barém. A capital do país é Doha, lar de mais de 80% de seus habitantes. O Catar também sediou a Copa do Mundo FIFA de 2022.","Le Qatar, en forme longue l'État du Qatar, est un émirat du Moyen-Orient d'une superficie de 11 586 km. Le Qatar est situé sur une petite péninsule s'avançant dans le golfe Persique et reliée à la péninsule Arabique au sud, où elle a une frontière terrestre avec l'Arabie saoudite. Sa capitale est Doha, sa langue officielle l'arabe, sa religion d'État l'islam et sa monnaie le riyal qatarien.","Il Qatar, ufficialmente Stato del Qatar, è un paese arabo del Medio Oriente affacciato sul golfo Persico; confina con l'Arabia Saudita a sud. È uno degli Stati più ricchi al mondo, forte della sua industria petrolifera.","Catar, cuyo nombre oficial es Estado de Catar, es un Estado soberano árabe ubicado en el oeste de Asia que ocupa la pequeña península homónima en el este de la península arábiga. Tiene una única frontera terrestre, por el sur con Arabia Saudita, mientras que el resto del territorio lo bañan las aguas del golfo Pérsico. Un estrecho de agua separa esta península del Estado insular de Baréin.","Doha","Doha","3214609","11581","264","Unitary|semi-constitutional monarchy","Arabic","Qatari","222780000000","0.886","Qatari riyal","UTC|AST","+974",".qaقطر."
