isoCode,name_en,name_pt,name_fr,name_it,name_es,flagUrl,description_en,description_pt,description_fr,description_it,description_es,capital,largestCity,population,areaKm2,densityKm2,government,officialLanguage,demonym,gdp,hdi,currency,timeZone,callingCode,internetTld
"EE","Estonia","Estónia","Estonie","Estonia","Estonia","https://upload.wikimedia.org/wikipedia/commons/thumb/8/8f/Flag_of_Estonia.svg/250px-Flag_of_Estonia.svg.png","Estonia, officially the Republic of Estonia, is a country in the Baltic region of Northern Europe. It is bordered to the north by the Gulf of Finland across from Finland, to the west by the Baltic Sea across from Sweden, to the south by Latvia, and to the east by Russia. The territory of Estonia consists of the mainland, the larger islands of Saaremaa and Hiiumaa, and over 2,300 other islands and islets on the east coast of the Baltic Sea. Its capital city of Tallinn, along with the city of Tartu, are the country's two largest urban areas. The Estonian language, of the Finnic family, is the official language and the first language of the majority of nearly 1.4 million people. Estonia is one of the least populous member states of the European Union.","A Estónia ou Estônia, oficialmente República da Estónia é um dos três Países Bálticos, situado na Europa Setentrional, constituído por uma porção continental e um grande arquipélago no mar Báltico. Limita ao norte com o golfo da Finlândia que o separa da Finlândia, a leste limita com a Rússia, ao sul com a Letónia e a oeste com o mar Báltico, que a separa da Suécia. Tem 45 mil km de área e em 2000 tinha 1 376 743 habitantes. A Estónia é membro da União Europeia desde 1 de maio de 2004 e da OTAN desde 29 de março de 2004.","L'Estonie, en forme longue la république d'Estonie, est un État souverain d'Europe du Nord.","L'Estonia, nome ufficiale Repubblica d'Estonia, con capitale Tallinn, è una repubblica parlamentare situata nell'Europa nord-orientale, confinante a est con la Russia e a sud con la Lettonia e bagnata a nord e a ovest dal Mar Baltico. Le coste sono frastagliate e fronteggiate da un arcipelago di circa ottocento isole, la più grande delle quali è l'isola di Saaremaa.","Estonia, oficialmente República de Estonia, es uno de los veintisiete Estados soberanos que forman la Unión Europea, y el más pequeño de los tres países bálticos. Limita al sur con Letonia, al este con Rusia, al norte con el golfo de Finlandia y al oeste con el mar Báltico.","Tallinn","Tallinn","1362954","45335","30.3","Unitary parliamentary republic","Estonian","Estonian","45000000000","0.905","Euro|€","UTC|EET","+372",".ee"
"EG","Egypt","Egito","Égypte","Egitto","Egipto","https://upload.wikimedia.org/wikipedia/commons/thumb/f/fe/Flag_of_Egypt.svg/250px-Flag_of_Egypt.svg.png","Egypt, officially the Arab Republic of Egypt, is a country spanning the northeast corner of Africa and southwest corner of Asia via the Sinai Peninsula. It is bordered by the Mediterranean Sea to the north, Palestine and Israel to the northeast, the Red Sea to the east, Sudan and the Sahara to the south, and Libya to the west. The Gulf of Aqaba in the northeast separates Egypt from Jordan and Saudi Arabia. Cairo is the capital, largest city, and leading cultural centre, while Alexandria is the second-largest city and an important hub of industry and tourism. With over 107 million inhabitants, Egypt is the most populous country in the Arab world, third-most populous country in Africa, and 15th-most populated in the world.","O Egito, oficialmente República Árabe do Egito, é um país localizado entre o nordeste da África e o sudoeste da Ásia, através da Península do Sinai. É um país mediterrâneo limitado pela Faixa de Gaza e Israel a nordeste, o Golfo de Ácaba e o Mar Vermelho a leste, o Sudão ao sul e a Líbia a oeste. Do outro lado do Golfo de Ácaba fica a Jordânia, do outro lado do Mar Vermelho, a Arábia Saudita e, do outro lado do Mediterrâneo, a Grécia, a Turquia e o Chipre, embora nenhum deles tenha uma fronteira terrestre com o Egito.","L'Égypte, en forme longue la république arabe d'Égypte, est un pays transcontinental se trouvant en Afrique du Nord-Est et, pour la péninsule du Sinaï, en Asie de l'Ouest. Située sur la côte sud de la Méditerranée orientale, le bassin Levantin, le pays a des frontières terrestres avec la Libye à l'ouest, le Soudan au sud, la mer Rouge à l'est, et Israël et la bande de Gaza de la Palestine au nord-est. La capitale, ville la plus peuplée du pays, est Le Caire. L'Égypte est le troisième pays le plus peuplé d'Afrique derrière le Nigeria et l'Éthiopie et le pays arabe le plus peuplé. En 2026, le pays compte une population de 119 724 402 habitants. La surface du pays est largement recouverte par le Sahara et la population est fortement concentrée sur les rives du Nil.","L'Egitto, ufficialmente Repubblica Araba d'Egitto, è un Paese transcontinentale che attraversa l'angolo nord-est dell'Africa e l'angolo sud-ovest dell'Asia attraverso un ponte di terra formato dalla penisola del Sinai. La maggior parte del suo territorio di 1 001 000 chilometri quadrati si trova nel Nord Africa e confina con il Mar Mediterraneo a nord, la striscia di Gaza e Israele a nord-est, il golfo di Aqaba e il Mar Rosso a est, il Sudan a sud e la Libia a ovest.","Egipto, oficialmente la República Árabe de Egipto, es un país soberano transcontinental. Está ubicado mayoritariamente en el extremo nororiental de África, mientras que en Asia se encuentra la península del Sinaí. Limita con Sudán al sur, con Libia al oeste, y al noreste con Israel y la Franja de Gaza. Al norte limita con el mar Mediterráneo y al este y sureste con el mar Rojo frente a Arabia Saudita.","Cairo","Cairo","107868296","1010408","106.8","semi-presidential republic|authoritarian","Arabic","Egyptian","429645000000","0.754","Egyptian pound","UTC|EET","+20",".egمصر."
"ER","Eritrea","Eritreia","Érythrée","Eritrea","Eritrea","https://upload.wikimedia.org/wikipedia/commons/thumb/2/29/Flag_of_Eritrea.svg/250px-Flag_of_Eritrea.svg.png","Eritrea, officially the State of Eritrea, is a country in the Horn of Africa region of East Africa. Its capital and largest city is Asmara. The country is bordered by Ethiopia to the south, Sudan to the west, and Djibouti to the southeast. The northeastern and eastern parts of Eritrea have an extensive coastline along the Red Sea. The country has a total area of approximately 117,600 km, and includes the Dahlak Archipelago and several of the Hanish Islands.","Eritreia, oficialmente Estado da Eritreia, é um país localizado no Chifre da África. Sua capital é Asmara. Faz fronteira com o Sudão a oeste, a Etiópia a sul, e Djibuti a sudeste. As partes nordeste e leste da Eritreia têm um extenso litoral ao longo do Mar Vermelho, tendo na outra margem a Arábia Saudita e o Iémen. O arquipélago de Dalaque e várias das ilhas Hanish também fazem parte da Eritreia. O país tem uma área total de 117 600 km², com uma população estimada em cerca de 5 milhões de habitantes. O nome do país é baseado no nome grego para o Mar Vermelho, que foi adotado pela primeira vez para a Eritreia italiana em 1890.","L'Érythrée, en forme longue l'État d'Érythrée est un État souverain situé en Afrique de l'Est. Il s'agit du pays le plus septentrional de la Corne de l'Afrique. Le pays a des frontières terrestres longues de 1 840 km avec Djibouti au sud-est, l'Éthiopie au sud et le Soudan à l'ouest, auxquelles s'ajoutent les frontières maritimes avec l'Arabie saoudite et le Yémen, en plus de celles avec Djibouti et le Soudan.","L'Eritrea, ufficialmente Stato di Eritrea, è uno Stato che si trova nell'estremità settentrionale del Corno d'Africa, confinante con il Sudan a ovest, con l'Etiopia a sud e con il Gibuti a sud-est. L'est ed il nord-est del Paese possiedono una lunga linea costiera sul Mar Rosso, che lo separa da Arabia Saudita e Yemen. Sono parte dell'Eritrea l'arcipelago delle isole Dahlak e alcune isole a ridosso delle isole Hanish.","Eritrea, oficialmente el Estado de Eritrea, es un país situado al noreste de África. Limita al norte y al oeste con Sudán; al sur con Etiopía y Yibuti, y el este es bañado por el mar Rojo. Forman igualmente parte de Eritrea las islas Dahlak, un archipiélago de coral cercano a la costa de Massawa. Su nombre proviene de la antigua colonia italiana Eritrea, creada el 1 de enero de 1890, llamada así por el Mare Erythraeum a su vez del griego «erythros», que quiere decir «rojo». Se independizó en 1993 de Etiopía. Su capital y ciudad más poblada es Asmara.","Asmara","Asmara","4950000","120000","29","presidential republic|totalitarian dictatorship","None","Eritrean","1982000000","0.503","Nakfa","UTC|EAT","+291",".er"
"ES","Spain","Espanha","Espagne","Spagna","España","https://upload.wikimedia.org/wikipedia/commons/thumb/8/89/Bandera_de_Espa%C3%B1a.svg/250px-Bandera_de_Espa%C3%B1a.svg.png","Spain, officially the Kingdom of Spain, is a country in Southern and Western Europe with territories in North Africa. Featuring the southernmost point of continental Europe, it is the largest country in Southern Europe and the fourth-most populous European Union member state. Spanning the majority of the Iberian Peninsula, its territory also includes the Canary Islands, in the Eastern Atlantic Ocean; the Balearic Islands, in the Western Mediterranean Sea; and the autonomous cities of Ceuta and Melilla, in mainland Africa. Peninsular Spain is bordered to the north by France, Andorra, and the Bay of Biscay; to the east and south by the Mediterranean Sea and Gibraltar and Morocco, through its exclaves in North Africa; and to the west by Portugal and the Atlantic Ocean. Spain's capital and largest city is Madrid; other major urban areas include Barcelona, Valencia, Seville, Zaragoza, Málaga, Murcia, and Palma de Mallorca.","Espanha, oficialmente Reino de/da Espanha, é um país principalmente localizado na Península Ibérica na Europa. Seu território também inclui dois arquipélagos: as ilhas Canárias, na costa da África, e as ilhas Baleares, no mar Mediterrâneo. Os enclaves africanos de Ceuta e Melilla fazem da Espanha o único país europeu a ter uma fronteira terrestre com um país africano. Várias pequenas ilhas no mar de Alborão também fazem parte do território espanhol. A Espanha continental é limitada a sul e a leste pelo Mediterrâneo, exceto por uma pequena fronteira terrestre com Gibraltar; a norte e a nordeste pela França, por Andorra e pelo Golfo da Biscaia; e a oeste e noroeste por Portugal e pelo Oceano Atlântico. Com uma área de 505 990 km, a Espanha é o maior país da Europa Meridional, o segundo maior país da Europa Ocidental e da União Europeia e o quarto maior país de todo o continente europeu. Também é o sexto país mais populoso da Europa e o quarto da UE. A capital e maior cidade é Madri; outras grandes áreas urbanas incluem Barcelona, Valência, Sevilha, Málaga, Bilbau e Granada.","L'Espagne, en forme longue le royaume d'Espagne, est un État souverain transcontinental d'Europe du Sud-Ouest, qui occupe la plus grande partie de la péninsule Ibérique. Sa superficie est de 505 990 km.","La Spagna, il cui nome ufficiale è Regno di Spagna, è uno Stato dell'Europa occidentale ed è membro dell'Unione europea. Monarchia parlamentare, la Spagna è situata all'estremità occidentale dell'Europa e occupa buona parte della superficie della penisola iberica.","España, formalmente Reino de España, es un país soberano transcontinental, constituido en Estado social y democrático de derecho y cuya forma de gobierno es la monarquía parlamentaria. Es uno de los veintisiete Estados soberanos que forman la Unión Europea. Su territorio, con capital en Madrid, está organizado en diecisiete comunidades autónomas, formadas a su vez por cincuenta provincias, dos ciudades autónomas y distintas plazas de soberanía ubicadas en el norte del continente africano.","Madrid","Madrid","49687120","506030","98","parliamentary constitutional monarchy","Espainiako Erresuma","Spaniard|Spanish","2091000000000","0.918","Euro|€","UTC|WET|CET","+34",".es"
"ET","Ethiopia","Etiópia","Éthiopie","Etiopia","Etiopía","https://upload.wikimedia.org/wikipedia/commons/thumb/7/71/Flag_of_Ethiopia.svg/250px-Flag_of_Ethiopia.svg.png","Ethiopia, officially the Federal Democratic Republic of Ethiopia, is a landlocked country located in the Horn of Africa region of East Africa. It shares borders with Eritrea to the north, Djibouti to the northeast, Somalia to the east, Kenya to the south, South Sudan to the west, and Sudan to the northwest. Ethiopia covers a land area of 1,104,300 square kilometres. As of 2025, it has around 135 million inhabitants, making it the 14th-most populous country. The national capital and largest city, Addis Ababa, lies several kilometres west of the East African Rift that splits the country into the African and Somali tectonic plates.","A Etiópia, oficialmente República Democrática Federal da Etiópia e anteriormente conhecida como Abissínia, é um país encravado no Chifre da África, sendo um dos mais antigos do mundo. É a segunda nação mais populosa da África e a décima maior em área. Faz fronteira com o Sudão e com o Sudão do Sul a oeste, com o Djibuti e a Eritreia ao norte, com a Somália ao leste, e o Quênia ao sul. Sua capital é a cidade de Adis Abeba.","L'Éthiopie, en forme longue la république démocratique fédérale d'Éthiopie est un État de la Corne de l'Afrique. L'Éthiopie a des frontières communes avec l'Érythrée au nord, la Somalie à l'est-sud-est, le Soudan au nord-ouest, le Soudan du Sud à l'ouest-sud-ouest, le Kenya au sud et la république de Djibouti au nord-est. Depuis l'indépendance de l'Érythrée en 1993, l'Éthiopie n'a plus d'accès à la mer.","L'Etiopia, ufficialmente denominata Repubblica Federale Democratica d'Etiopia, è uno Stato dell'Africa orientale situato nel Corno d'Africa, con una popolazione di circa 121,4 milioni di abitanti e con capitale Addis Abeba.","Etiopía, oficialmente la República Democrática Federal de Etiopía, antiguamente conocida como Abisinia, es un país sin litoral situado en el Cuerno de África. Las estimaciones demográficas a 2021 lo sitúan como el segundo país más poblado de África, solo por detrás de Nigeria y el duodécimo a nivel mundial, así como el país sin litoral más poblado del mundo.","Addis Ababa","Addis Ababa","135500000","1104300","92.7","parliamentary republic|authoritarian","Itiyoppiya Federalih Demokrasih Ummuno","Ethiopian","145030000000","0.492","Birr","UTC|EAT","+251",".et"
"FI","Finland","Finlândia","Finlande","Finlandia","Finlandia","https://upload.wikimedia.org/wikipedia/commons/thumb/b/bc/Flag_of_Finland.svg/250px-Flag_of_Finland.svg.png","Finland, or the Republic of Finland, is a Nordic country in Northern Europe. It borders Sweden to the northwest, Norway to the north, and Russia to the east, with the Gulf of Bothnia to the west and the Gulf of Finland to the south, opposite Estonia. Its capital and largest city is Helsinki. Finland has a population of 5.7 million. The official languages are Finnish and Swedish, the mother tongues of 83.5 percent and 5.0 percent of the population, respectively. Finland's climate varies from humid continental in the south to boreal in the north. Its land is predominantly covered by boreal forest, with over 180,000 recorded lakes.","A Finlândia, oficialmente República da Finlândia, é um país nórdico situado na região da Fino-Escandinávia, no norte da Europa. Faz fronteira com a Suécia a oeste, com a Rússia a leste e com a Noruega ao norte, enquanto a Estônia está ao sul através do Golfo da Finlândia. A capital do país e sua maior cidade é Helsinque, em finlandês Helsinki, e a segunda maior cidade é Tampere, localizada a cerca de 180 km a norte da capital. Cerca de 5,3 milhões de pessoas vivem na Finlândia, estando a maior parte concentrada no sul do país. É o oitavo maior país da Europa em extensão e o país menos densamente povoado da União Europeia. A língua materna de quase toda a população é o finlandês, que é uma das línguas fino-úgricas e é mais estreitamente relacionado com o estoniano. O finlandês é apenas uma das quatro línguas oficiais da UE que não são de origem Indo-Europeia. A segunda língua oficial da Finlândia — o sueco — é a língua nativa falada por 5,5% da população.","La Finlande, en forme longue la république de Finlande, est un État souverain d'Europe du Nord dont le territoire s'étend sur le flanc est et sur 100 000 îles de la mer Baltique. La partie continentale possède près de 200 000 lacs et partage ses frontières terrestres avec la Russie à l'est, et avec la Suède et la Norvège au nord, tandis que les archipels de Turku et d'Åland constituent l'essentiel de la partie insulaire du pays.","La Finlandia, ufficialmente Repubblica di Finlandia, è uno Stato dell'Europa facente parte della regione nota come Fennoscandia e, in alcuni casi, anche della penisola scandinava. Confina con la Svezia a ovest, la Norvegia a nord e la Russia a est. Si affaccia a sud sul golfo di Finlandia, sulla cui sponda meridionale si trova l'Estonia. È uno Stato membro dell'Unione europea, dell'ONU e della NATO.","Finlandia, oficialmente la República de Finlandia, es uno de los veintisiete Estados soberanos que forman la Unión Europea. Está situado en el noreste de Europa. Tiene fronteras al oeste con Suecia, al este con Rusia y al norte con Noruega. Por el oeste y el sur está rodeada por el mar Báltico, que la separa de Suecia y Estonia, cruzando los golfos de Botnia y Finlandia, respectivamente. La capital y ciudad más importante del país es Helsinki, y la segunda ciudad más grande y área urbana más grande es Tampere, 180 kilómetros al norte de Helsinki.","Helsinki","Helsinki","5652881","338455","18.4","Unitary parliamentary republic","Finnish|Swedish","Finnish|Finn","337669000000","0.948","Euro|€","UTC|EET","+358",".fi|.ax"
"FJ","Fiji","Fiji","Fidji","Figi","Fiyi","https://upload.wikimedia.org/wikipedia/commons/thumb/b/ba/Flag_of_Fiji.svg/250px-Flag_of_Fiji.svg.png","Fiji, officially the Republic of Fiji, is an archipelagic country in Melanesia, part of Oceania in the South Pacific Ocean. It lies about 1,100 nautical miles north-northeast of New Zealand. Fiji consists of an archipelago of more than 330 islands—of which about 110 are permanently inhabited—and more than 500 islets, amounting to a total land area of about 18,300 square kilometres. The most outlying island group is Ono-i-Lau. About 87% of the total population live on the two major islands, Viti Levu and Vanua Levu. About three-quarters of Fijians live on Viti Levu's coasts, either in the capital city of Suva, or in smaller urban centres such as Nadi or Lautoka. The interior of Viti Levu is sparsely inhabited because of its terrain.","A República das Fiji ou das Fíji, por vezes escrito Fidji, anteriormente conhecida como República das Ilhas Fiji, é um país insular da Oceania, composto por 332 ilhas no Oceano Pacífico. Fíji faz fronteira marítima com Tuvalu e com o território francês de Wallis e Futuna a norte, com Tonga a leste, e com o território francês da Nova Caledónia, com Vanuatu e com as Ilhas Salomão a oeste. A sul, a terra mais próxima corresponde às ilhas neozelandesas de Kermadec, mas estão bastante afastadas.","Les Fidji, en forme longue la république des Fidji, est un pays d'Océanie situé dans l'Ouest de l'océan Pacifique sud. L'archipel, qui fait partie de la Mélanésie, se trouve à 744 km à l'ouest-nord-ouest des Tonga, à 788 km au sud-ouest de Wallis-et-Futuna et à 1 067 km au sud des Tuvalu.","Le Figi, ufficialmente Repubblica delle Figi sono uno Stato insulare dell'Oceania che sorge sull'arcipelago omonimo, composto di 322 isole, di cui 106 abitate permanentemente, e 522 isolotti.","Fiyi, oficialmente la República de Fiyi, es un país soberano insular ubicado en Oceanía, localizado en el océano Pacífico y constituido en una república parlamentaria. La capital y ciudad más poblada es Suva.","Suva","Suva","926276","18274","46.4","Unitary parliamentary republic","English|Fijian|Standard Hindi|Fiji Hindi","Fijian","5511000000","0.731","Fijian dollar","UTC","+679",".fj"
"FM","Federated States of Micronesia","Estados Federados da Micronésia","États fédérés de Micronésie","Stati Federati di Micronesia","Estados Federados de Micronesia","https://upload.wikimedia.org/wikipedia/commons/thumb/e/e4/Flag_of_the_Federated_States_of_Micronesia.svg/250px-Flag_of_the_Federated_States_of_Micronesia.svg.png","The Federated States of Micronesia, or simply Micronesia, is an island country in Micronesia, a region of Oceania. The federation encompasses the majority of the Caroline Islands and consists of four states—from west to east: Yap, Chuuk, Pohnpei, and Kosrae—that span the western Pacific just north of the equator for a longitudinal distance of almost 2,700 km. Together, the states comprise around 607 islands and a combined land area of approximately 702 km or 271 sq mi.","Os Estados Federados da Micronésia, coloquialmente chamados apenas de Micronésia, são uma nação insular da Oceania, composta por cerca de 607 ilhas que se estendem por 2 900 km pelo arquipélago das Ilhas Carolinas no oceano Pacífico, a leste das Filipinas e a norte da Papua-Nova Guiné. O país é um Estado soberano em livre associação com os Estados Unidos, país que tem total responsabilidade pela defesa dos EFM. O território do atual Estado fazia parte do Protetorado das Ilhas do Pacífico, das Nações Unidas, sob administração tutelar dos Estados Unidos. Em 1979, o país adotou uma constituição e, em 1986, a independência foi alcançada sob um Tratado de Livre Associação com os Estados Unidos.","Les États fédérés de Micronésie en forme longue ou Micronésie en forme courte sont un État fédéral insulaire du Sud-Ouest de l'océan Pacifique nord, constitué de quatre États, d'ouest en est, Yap, Chuuk, Pohnpei et Kosrae. Le pays s'étend sur 2 860 km à travers l'archipel des îles Carolines. Il comporte des frontières maritimes avec les Îles Marshall, la Papouasie-Nouvelle-Guinée, les Palaos et les États-Unis par l'intermédiaire de Guam.","Gli Stati Federati di Micronesia, o Micronesia, sono uno Stato insulare federale dell'Oceania.","Los Estados Federados de Micronesia, o simplemente Micronesia, son un Estado soberano insular en la región de Micronesia, cuya forma de gobierno es la república federal democrática. Administrativamente, está constituido por cuatro estados —de oeste a este: Yap, Chuuk, Pohnpei y Kosrae— esparcidos a lo largo del océano Pacífico, al norte del ecuador terrestre. Son alrededor de 607 islas que cubren una distancia longitudinal de 2700 kilómetros. Su capital es Palikir, en la isla de Pohnpei.","Palikir","Weno","75817","702","150.4","assembly-independent|non-partisan democracy","English","Micronesian","500000000","0.615","United States dollar","UTC","+691",".fm"
